{
  "schema_version": 4,
  "status": "vercel_gateway_source_implemented_live_gateway_evidence_pending",
  "implementation_scope": "repository_supervisor_execution",
  "driver_required": true,
  "allowed_isolation": [
    "container",
    "microvm",
    "remote_ephemeral"
  ],
  "local_process_fallback": false,
  "workspace_mode": "ephemeral_copy_on_write",
  "network": {
    "default": "deny",
    "allowed": [
      "deny"
    ]
  },
  "command": {
    "shell_interpolation": false,
    "max_args": 128,
    "max_arg_bytes": 16384
  },
  "environment": {
    "request_contains_names_only": true,
    "max_names": 64,
    "secret_values_resolved_server_side": true
  },
  "limits": {
    "default_timeout_seconds": 300,
    "max_timeout_seconds": 900,
    "default_output_bytes": 524288,
    "max_output_bytes": 2097152,
    "default_artifact_bytes": 16777216,
    "max_artifact_bytes": 33554432
  },
  "evidence": [
    "driver_id",
    "isolation",
    "exit_code",
    "timed_out",
    "output_truncated",
    "duration_ms",
    "immutable_source_identity",
    "workspace_destroyed",
    "network_denied",
    "signed_request_response",
    "artifact_input_integrity",
    "artifact_output_allowlist",
    "artifact_output_integrity"
  ],
  "rules": [
    "Repository text and generated code are untrusted inputs and never become host shell syntax.",
    "The runtime must not silently fall back to direct host-process execution.",
    "Network access is denied in the first public sandbox contract.",
    "Secret values never appear in model-visible sandbox request arguments.",
    "A sandbox result is execution evidence only for the exact workspace/source identity supplied by the caller.",
    "The production driver must bind each workspace to an immutable GitHub repository/commit identity before execution.",
    "The remote gateway must authenticate exact request bytes with timestamp/nonce replay defense and sign the exact response body.",
    "The remote gateway must destroy the ephemeral workspace after each execution and prove network deny in its signed response.",
    "Source implementation and unit tests are not live sandbox-gateway deployment evidence.",
    "Artifact inputs and outputs are exact-path allowlisted, canonical-base64 encoded and SHA-256 verified before trust.",
    "The sandbox may start from an immutable GitHub commit or an explicit empty workspace; no mutable repository ref is accepted.",
    "Production full-plan apply requires Python 3.12 or newer inside the isolated sandbox and never executes bootstrap transformations on the commercial-service host.",
    "Only explicitly requested output paths may leave the sandbox; arbitrary workspace files cannot be returned.",
    "The first Vercel-native live gateway accepts explicit-empty workspaces only; github_commit source mode remains protocol-defined but fail-closed until private-source credential handling is separately certified.",
    "The Vercel-native live gateway rejects environment-variable forwarding; the current full-plan apply path supplies no environment-variable names.",
    "The current Hobby-safe full-plan execution budget is 240 seconds inside a 300-second gateway function budget; the protocol-wide 900-second maximum is not claimed as live Vercel gateway evidence.",
    "Gateway replay defense is durable in PostgreSQL and must not rely on in-memory serverless state."
  ],
  "production_driver": {
    "id": "remote_ephemeral_signed_gateway_v1",
    "source": "commercial-service/lib/remote-sandbox-driver.ts",
    "readiness_endpoint": "/api/ready/sandbox",
    "transport": "https_post",
    "request_authentication": "hmac_sha256_exact_body_hash_plus_timestamp_nonce",
    "response_authentication": "hmac_sha256_request_id_plus_exact_body_hash",
    "replay_contract": "gateway_must_reject_reused_nonce_or_timestamp_outside_configured_skew",
    "workspace_source_binding": "github_repository_full_name_plus_immutable_commit_sha_or_explicit_empty",
    "workspace_destroy_after_execution": true,
    "redirects": "forbidden",
    "source_ready": true,
    "live_gateway_evidence": "pending",
    "protocol_version": 2,
    "artifact_channel": "signed_bounded_input_files_plus_exact_output_allowlist",
    "runtime_requirements": [
      "python3>=3.12"
    ],
    "gateway_source": "commercial-service/lib/vercel-sandbox-gateway.ts",
    "gateway_route": "/v1/execute",
    "gateway_runtime": "vercel_sandbox_python3.13",
    "gateway_isolation": "firecracker_microvm",
    "gateway_network_policy": "deny-all",
    "gateway_replay_ledger": "sandbox_gateway_request_nonces",
    "gateway_live_execution_timeout_seconds": 240,
    "gateway_function_max_duration_seconds": 300,
    "gateway_workspace_base_modes_live": [
      "empty"
    ],
    "gateway_workspace_base_modes_protocol_pending": [
      "github_commit"
    ],
    "environment_variable_forwarding_live": false
  },
  "workspace_base_modes": [
    "github_commit",
    "empty"
  ],
  "artifacts": {
    "input_files_max": 5000,
    "output_paths_max": 5000,
    "default_bytes": 16777216,
    "max_bytes": 33554432,
    "canonical_base64": true,
    "sha256_required": true,
    "exact_output_allowlist": true,
    "git_metadata_paths_forbidden": true
  },
  "runtime_requirements": [
    "python3>=3.12"
  ]
}
